Winner,Loser,Analysis,Reasoning,pair_index,pair_ids,input_hypo_1,input_hypo_2
"(SGLT2 Uptake Assay, 6)","(Mitochondrial Membrane Potential Assay, 2)","Candidate 1 (Mitochondrial Membrane Potential Assay) offers a well-validated readout of mitochondrial health in renal tubular epithelial cells, modeling an early and central pathogenic event in CKD. It uses high-content imaging of TMRM or JC-1 dyes to detect ΔΨm loss under CKD-mimicking stressors. Strengths include early predictive biomarker capability and real-time dynamic monitoring. Weaknesses include dependence on cell culture conditions, limited functional specificity (requires complementary assays for complete mitochondrial characterization), and moderate throughput.

Candidate 2 (SGLT2 Uptake Assay) quantifies SGLT2-mediated glucose uptake via 2-NBDG fluorescence in RPTEC monolayers, directly modeling a clinically validated CKD mechanism. Its strengths are functional specificity for the primary drug target, high throughput, nonradioactive format, and direct measurement of transporter activity. It can be augmented with ROS readouts for secondary effects. Weaknesses include ensuring physiological SGLT2 expression over passages and the simplified 2D environment that may miss complex in vivo interactions.

Both assays are biologically relevant and simple; however, Candidate 2 affords a direct, high-throughput functional endpoint closely aligned with existing clinical interventions (SGLT2 inhibitors).","Between the two, the SGLT2 Uptake Assay (Candidate 2) is superior. It directly measures the primary CKD drug target’s function in a well-characterized cell model, delivers rapid and quantitative readouts, and is readily scalable to high-throughput screening. Its translational relevance is bolstered by strong clinical validation of SGLT2 inhibition in CKD. In contrast, the mitochondrial ΔΨm assay, while valuable for mechanistic insights, is less direct as a drug screening endpoint, lower in throughput, and requires additional complementary assays to fully capture mitochondrial pathobiology.",0,"(2, 6)","{'hypothesis': 'Mitochondrial Membrane Potential Assay', 'answer': ""Assay Overview:  \nThe proposed assay employs mitochondrial membrane potential (ΔΨm) measurements using fluorescent dyes such as TMRM or JC-1 in renal tubular epithelial cells (TECs) to evaluate mitochondrial health. This assay principally models mitochondrial dysfunction—a key early event in chronic kidney disease (CKD) pathogenesis—by quantifying the loss of ΔΨm, which is indicative of mitochondrial depolarization. Measurements are performed via high-content imaging techniques that capture changes in dye fluorescence intensity and color shifts (red/green ratio for JC-1), providing real-time insights into mitochondrial polarization (small2015identificationofpotential pages 124-127, ho2022oxidativestressand pages 3-5). Typically, human TEC lines such as HK-2 cells are used under conditions that mimic CKD-related stressors like hypoxia or oxidative damage, thereby recapitulating aspects of the tissue injury observed in CKD (kim2018inflammasomeindependentroleof pages 2-3).\n\nBiomedical Evidence:  \nMitochondrial dysfunction plays a central role in CKD progression by triggering oxidative stress, apoptotic pathways, and subsequent renal cell injury. The early loss of ΔΨm not only serves as a precursor to cell death and inflammation but is intimately linked with the impairment of energy metabolism in the kidney, which is vital for tubular function (pedrazachaverri2016newpathogenicconcepts pages 3-4). Clinically, CKD has been associated with decreased mitochondrial ATP production and increased reactive oxygen species, underscoring the significance of mitochondrial health in the disease. Studies indicate that disruptions in mitochondrial bioenergetics precede clinical manifestations such as proteinuria and tubulointerstitial fibrosis, thus providing a rationale for early intervention targeting mitochondrial preservation (ho2022oxidativestressand pages 22-23, mapuskar2023mitochondrialoxidativemetabolism pages 8-9).\n\nPrevious Use:  \nAssays measuring ΔΨm using TMRM or JC-1 dyes have been widely used in experimental models to evaluate mitochondrial damage in both acute kidney injury (AKI) and CKD. For instance, previous studies have utilized JC-1 dye assays to monitor the early mitochondrial responses to hypoxia and oxidative stress, thereby establishing an essential link between mitochondrial dysfunction and downstream pathogenic events including inflammasome activation (kim2018inflammasomeindependentroleof pages 2-3). In drug discovery models, these assays have been leveraged to screen for mitochondrial-protective compounds that stabilize ΔΨm and reduce subsequent cellular apoptosis; such assays have successfully identified candidates that mitigate mitochondrial fragmentation and improve cell viability under stress conditions (small2015identificationofpotential pages 314-314, eirin2017theemergingrole pages 13-14). Furthermore, extensive literature in biomedical research and clinical trials highlights that targeting mitochondrial dysfunction can yield therapeutic benefits, reinforcing the assay’s acceptance in preclinical drug discovery pipelines (Clinical Trials Search: mitochondrial membrane potential OR mitochondrial dysfunction AND chronic kidney disease).\n\nOverall Evaluation:  \nThis ΔΨm assay presents several strengths for evaluating therapeutics in CKD. It offers an early, quantifiable biomarker of mitochondrial health in TECs that can predict downstream cellular events, thereby allowing rapid assessment of drug efficacy in preserving mitochondrial integrity. The use of high-content imaging facilitates dynamic monitoring over time, potentially uncovering subtle drug effects that traditional end-point assays might miss (ho2022oxidativestressand pages 3-5, small2015identificationofpotential pages 317-318). However, there are some weaknesses to consider. The assay's sensitivity may be influenced by the chosen cell line and culture conditions, which could limit its translatability to in vivo systems. Moreover, while ΔΨm is a critical indicator, mitochondrial dysfunction in CKD is multifactorial and involves additional elements such as altered biogenesis, dynamics (fusion/fission), and ROS production; hence, this assay should ideally be complemented with additional readouts to fully characterize mitochondrial and cellular responses (eirin2017theemergingrole pages 8-9, pedrazachaverri2016newpathogenicconcepts pages 3-4). Overall, the assay is a valuable component of a multi-parametric drug screening platform targeting mitochondrial pathways in CKD."", 'index': '2'}","{'hypothesis': 'SGLT2 Uptake Assay', 'answer': 'Assay Overview:  \nThe proposed assay utilizes the fluorescent glucose analog 2-NBDG to quantitatively measure SGLT2-mediated glucose uptake in renal proximal tubule epithelial cell (RPTEC) monolayers. This assay aims to model the hyperreabsorption phenomenon seen in Chronic Kidney Disease (CKD) by assessing how SGLT2 activity contributes to increased intracellular glucose loads that subsequently enhance oxidative stress and metabolic perturbations. The key measurements include the fluorescence intensity corresponding to 2-NBDG uptake measured by microplate readers or through microscopy imaging, and the assay can be complemented by assessing downstream reactive oxygen species (ROS) production. HK-2 cells, a widely accepted RPTEC model that retains key epithelial and transporter characteristics, serve as the cell substrate; alternative primary human proximal tubular cells have also been discussed for achieving physiological relevance (lu2019afluorescentglucose pages 1-3, lu2019afluorescentglucose pages 3-5).\n\nBiomedical Evidence:  \nThe biomedical rationale for targeting SGLT2 in CKD stems from its central role in glucose reabsorption in proximal tubular cells. In diabetic nephropathy, persistent hyperglycemia causes an upregulation of SGLT2, leading to hyperreabsorption of glucose. This high intracellular glucose load is known to drive the production of ROS via several metabolic pathways, thereby contributing to both metabolic and oxidative stress that are intimately linked to the progression of CKD (eleftheriadis2020aunifyingmodel pages 1-2, zaibi2021protectiveeffectsof pages 2-4). Clinical and preclinical studies have demonstrated that SGLT2 inhibitors not only lower blood glucose by promoting glucosuria, but also reduce inflammatory and oxidative stress markers in RPTEC, suggesting that assay readouts can inform on both transporter inhibition and secondary beneficial effects on cellular stress responses (baer2020nocytotoxicand pages 3-6). The ability to mimic these disease-relevant processes in vitro, using a nonradioactive, high-throughput fluorescent assay, positions this method as an attractive tool for early drug discovery and translational research in CKD (Clinical Trials Search: SGLT2 activity assay OR SGLT2 in vitro).\n\nPrevious Use:  \nHistorically, the use of 2-NBDG fluorescence assays has been validated in studies examining SGLT2 function in HK-2 cells. For example, research by Lu et al. demonstrated that sodium-dependent uptake of 2-NBDG could be specifically inhibited by clinical SGLT2 inhibitors like dapagliflozin, confirming the assay’s specificity and sensitivity (lu2019afluorescentglucose pages 3-5). Additionally, similar fluorescent techniques have been applied in other renal cell models under hyperglycemic conditions to mimic diabetic nephropathy, thereby linking transporter function to oxidative stress and subsequent cellular injury (nongthombam2025breakingboundariesin pages 3-5). These studies underscore the assay’s utility in elucidating SGLT2-mediated mechanisms and have established its validity for drug screening and mechanistic studies targeting CKD pathophysiology (baer2020nocytotoxicand pages 14-15).\n\nOverall Evaluation:  \nStrengths of the assay include its specificity for SGLT2 via sodium-dependent uptake assessments, its nonradioactive approach which improves safety and regulatory compliance, and its adaptability to high-throughput screening formats that are essential for early-stage drug discovery. The use of human RPTEC models, such as HK-2 cells, enhances the translational relevance compared to non-human or transfected cell lines (lu2019afluorescentglucose pages 1-3, chapron2018renaltubulartransport pages 54-58). Furthermore, the assay not only measures transporter activity but can also be coupled with additional readouts like ROS production, allowing for a comprehensive evaluation of metabolic and oxidative stress associated with CKD.\n\nOn the downside, challenges include maintaining the physiological expression of SGLT2 over multiple passages and ensuring that the in vitro conditions adequately replicate the complex in vivo microenvironment of the kidney proximal tubule. Additionally, while the assay provides rapid readouts for SGLT2 inhibition, it may require integration with other models (such as 3D microphysiological systems) for full mechanistic insights into CKD progression (secker2018functionalapproachesto pages 125-127).\n\nIn summary, the SGLT2 uptake assay using 2-NBDG in RPTEC monolayers represents a robust and physiologically relevant approach for early-stage therapeutic evaluation in CKD, with strong support from both biomedical and clinical literature (lu2019afluorescentglucose pages 1-3, eleftheriadis2020aunifyingmodel pages 1-2).', 'index': '6'}"
"(SGLT2 Uptake Assay, 6)","(Metabolic Flux (Seahorse) Assay, 7)","Candidate 1 (SGLT2 Uptake Assay) and Candidate 2 (Metabolic Flux (Seahorse) Assay) both offer functional in vitro readouts relevant to CKD, but differ in complexity, throughput, and direct disease linkage. The SGLT2 uptake assay uses 2-NBDG fluorescence in HK-2 or primary RPTEC monolayers to quantify glucose reabsorption, directly modeling the hyperreabsorption and oxidative stress axis implicated in diabetic and non-diabetic CKD. It is nonradioactive, amenable to 96-well high-throughput formats, and can be coupled with ROS measurements as a downstream functional endpoint. Its limitations include maintenance of transporter expression over passages and limited ability to replicate the full nephron microenvironment. The Seahorse metabolic flux assay provides real-time measurements of OCR and ECAR in primary TECs, dissecting detailed parameters of mitochondrial respiration and glycolysis. It has strong mechanistic relevance given the central role of mitochondrial dysfunction in CKD, but requires specialized instrumentation, complex cell isolation protocols, and is lower throughput with greater variability due to primary cell handling and passage effects. While the Seahorse platform yields multiparametric bioenergetic profiles, its operational complexity and cost limit rapid screening. By contrast, the SGLT2 assay delivers a simple, rapid, disease-relevant functional endpoint with established reproducibility in standard lab settings and direct translational relevance to SGLT2 inhibitor drug discovery.","Based on criteria emphasizing simplicity, speed of readout, direct measurement of disease-relevant functions, and adaptability to standard lab equipment, the SGLT2 Uptake Assay (Candidate 6) is preferred. It directly quantifies a key transporter activity implicated in CKD pathogenesis, supports high-throughput screening, and can be combined with oxidative stress assays for a comprehensive yet straightforward evaluation. The Seahorse metabolic flux assay, while scientifically robust, is operationally complex, lower throughput, and requires specialized instrumentation, making it less optimal for rapid early-stage drug testing in CKD.",1,"(6, 7)","{'hypothesis': 'SGLT2 Uptake Assay', 'answer': 'Assay Overview:  \nThe proposed assay utilizes the fluorescent glucose analog 2-NBDG to quantitatively measure SGLT2-mediated glucose uptake in renal proximal tubule epithelial cell (RPTEC) monolayers. This assay aims to model the hyperreabsorption phenomenon seen in Chronic Kidney Disease (CKD) by assessing how SGLT2 activity contributes to increased intracellular glucose loads that subsequently enhance oxidative stress and metabolic perturbations. The key measurements include the fluorescence intensity corresponding to 2-NBDG uptake measured by microplate readers or through microscopy imaging, and the assay can be complemented by assessing downstream reactive oxygen species (ROS) production. HK-2 cells, a widely accepted RPTEC model that retains key epithelial and transporter characteristics, serve as the cell substrate; alternative primary human proximal tubular cells have also been discussed for achieving physiological relevance (lu2019afluorescentglucose pages 1-3, lu2019afluorescentglucose pages 3-5).\n\nBiomedical Evidence:  \nThe biomedical rationale for targeting SGLT2 in CKD stems from its central role in glucose reabsorption in proximal tubular cells. In diabetic nephropathy, persistent hyperglycemia causes an upregulation of SGLT2, leading to hyperreabsorption of glucose. This high intracellular glucose load is known to drive the production of ROS via several metabolic pathways, thereby contributing to both metabolic and oxidative stress that are intimately linked to the progression of CKD (eleftheriadis2020aunifyingmodel pages 1-2, zaibi2021protectiveeffectsof pages 2-4). Clinical and preclinical studies have demonstrated that SGLT2 inhibitors not only lower blood glucose by promoting glucosuria, but also reduce inflammatory and oxidative stress markers in RPTEC, suggesting that assay readouts can inform on both transporter inhibition and secondary beneficial effects on cellular stress responses (baer2020nocytotoxicand pages 3-6). The ability to mimic these disease-relevant processes in vitro, using a nonradioactive, high-throughput fluorescent assay, positions this method as an attractive tool for early drug discovery and translational research in CKD (Clinical Trials Search: SGLT2 activity assay OR SGLT2 in vitro).\n\nPrevious Use:  \nHistorically, the use of 2-NBDG fluorescence assays has been validated in studies examining SGLT2 function in HK-2 cells. For example, research by Lu et al. demonstrated that sodium-dependent uptake of 2-NBDG could be specifically inhibited by clinical SGLT2 inhibitors like dapagliflozin, confirming the assay’s specificity and sensitivity (lu2019afluorescentglucose pages 3-5). Additionally, similar fluorescent techniques have been applied in other renal cell models under hyperglycemic conditions to mimic diabetic nephropathy, thereby linking transporter function to oxidative stress and subsequent cellular injury (nongthombam2025breakingboundariesin pages 3-5). These studies underscore the assay’s utility in elucidating SGLT2-mediated mechanisms and have established its validity for drug screening and mechanistic studies targeting CKD pathophysiology (baer2020nocytotoxicand pages 14-15).\n\nOverall Evaluation:  \nStrengths of the assay include its specificity for SGLT2 via sodium-dependent uptake assessments, its nonradioactive approach which improves safety and regulatory compliance, and its adaptability to high-throughput screening formats that are essential for early-stage drug discovery. The use of human RPTEC models, such as HK-2 cells, enhances the translational relevance compared to non-human or transfected cell lines (lu2019afluorescentglucose pages 1-3, chapron2018renaltubulartransport pages 54-58). Furthermore, the assay not only measures transporter activity but can also be coupled with additional readouts like ROS production, allowing for a comprehensive evaluation of metabolic and oxidative stress associated with CKD.\n\nOn the downside, challenges include maintaining the physiological expression of SGLT2 over multiple passages and ensuring that the in vitro conditions adequately replicate the complex in vivo microenvironment of the kidney proximal tubule. Additionally, while the assay provides rapid readouts for SGLT2 inhibition, it may require integration with other models (such as 3D microphysiological systems) for full mechanistic insights into CKD progression (secker2018functionalapproachesto pages 125-127).\n\nIn summary, the SGLT2 uptake assay using 2-NBDG in RPTEC monolayers represents a robust and physiologically relevant approach for early-stage therapeutic evaluation in CKD, with strong support from both biomedical and clinical literature (lu2019afluorescentglucose pages 1-3, eleftheriadis2020aunifyingmodel pages 1-2).', 'index': '6'}","{'hypothesis': 'Metabolic Flux (Seahorse) Assay', 'answer': 'Assay Overview:  \nThe proposed assay employs the Seahorse metabolic flux platform to measure mitochondrial bioenergetics via oxygen consumption rate (OCR) and extracellular acidification rate (ECAR) in kidney tubular epithelial cells (TECs). This assay models key metabolic derangements implicated in chronic kidney disease (CKD) pathogenesis. It is designed to quantify dynamic shifts between oxidative phosphorylation and glycolysis in response to drug treatment. Typically, primary TECs—isolated and characterized to preserve proximal and distal tubule markers—are cultured and then subjected to assays in specialized media. Mitochondrial inhibitors (e.g., oligomycin, FCCP, and rotenone/antimycin A) and metabolic substrates (e.g., palmitate conjugated to BSA in the presence or absence of glycolysis inhibitors) are applied sequentially to parse out basal respiration, ATP-linked respiration, maximal respiration, spare respiratory capacity, and compensatory glycolysis (ding2018isolationcharacterizationand pages 3-4, ding2018isolationcharacterizationand pages 8-9).\n\nBiomedical Evidence:  \nMitochondrial dysfunction features prominently in CKD pathogenesis. Abnormalities in electron transport chain components, fatty acid oxidation, and overall cellular bioenergetics are observed in both experimental models and clinical cases of CKD. Studies have demonstrated that TECs in CKD models exhibit impaired mitochondrial respiration, reduced fatty acid oxidation capacity, and metabolic reprogramming that mirrors in vivo pathologies (li2021targetingmitochondriaand pages 7-8, thome2021mitochondrialbioenergeticand pages 16-17). Furthermore, clinical evidence indicates that defective mitochondrial bioenergetics correlates with renal functional decline, underscoring the relevance of directly measuring OCR and ECAR as surrogate markers for mitochondrial health (thome2021mitochondrialbioenergeticand pages 1-2). By capturing these functional parameters in real time, the Seahorse assay bridges the gap between cellular metabolism and CKD pathobiology, thereby enabling the identification and validation of therapeutics that restore mitochondrial function.\n\nPrevious Use:  \nThe Seahorse metabolic flux assay has been successfully utilized to elucidate metabolic defects in renal cell culture models and animal models of CKD. For example, detailed protocols describe isolation and metabolic characterization of TECs using the Seahorse platform, where changes in OCR and ECAR provided mechanistic insights into mitochondrial dysfunction and a shift in substrate utilization—particularly a reliance on defective fatty acid oxidation in fibrotic versus healthy cells (ding2018isolationcharacterizationand pages 4-8, ding2018isolationcharacterizationand pages 8-9). Additionally, this assay has been applied in drug screening efforts, where candidate compounds were evaluated for their ability to improve bioenergetic parameters, thus linking OCR/ECAR profiles to therapeutic efficacy (podrini2018dissectionofmetabolic pages 11-12). The platform’s sensitivity has also made it a mainstay in other mitochondrial studies involving renal tissues, providing a robust means to dissect metabolic reprogramming in CKD and related disease models (thome2021mitochondrialbioenergeticand pages 19-20).\n\nOverall Evaluation:  \nStrengths of this assay lie in its real-time, high-throughput capacity to quantitatively assess key parameters of mitochondrial function. Its ability to dissect complex bioenergetic profiles—ranging from basal respiration to maximal respiratory capacity and glycolytic compensation—makes it a compelling tool for early-stage drug discovery in CKD (ding2018isolationcharacterizationand pages 2-3, ding2018isolationcharacterizationand pages 8-9). The assay is highly relevant, given that mitochondrial dysfunction is a core component of CKD pathogenesis, supported by both biomedical and clinical studies (thome2021mitochondrialbioenergeticand pages 16-17, li2021targetingmitochondriaand pages 7-8). \n\nHowever, some weaknesses exist. In vitro TEC models may not fully recapitulate the in vivo complexity of CKD, where systemic influences such as uremic toxins and hemodynamic changes also drive disease progression. Furthermore, variability in cell isolation methods and passage-dependent changes in mitochondrial function might limit reproducibility and translational relevance (ding2018isolationcharacterizationand pages 8-9). Nonetheless, when combined with complementary approaches, such as transcriptomics and proteomics (thome2021mitochondrialbioenergeticand pages 19-20), the Seahorse metabolic flux assay remains a highly valuable tool for mechanistic studies and preclinical therapeutic screening in CKD research.', 'index': '7'}"
